{
  "schema_version": 1,
  "request_id": "ARQ-f2s-adapter-legacy",
  "created_at": "2026-08-27T18:11:00+08:00",
  "command": "lead_designer_takeover",
  "project_ref": "f2s:Demo/deepdive",
  "host_write_target_ref": "f2s:Demo/deepdive/CHANGELOG.md#analysis-decision",
  "intent": "analyze",
  "goal": "让主策划 Agent 复盘试玩证据并判断是否需要制作人选择。",
  "requester_role": "agent",
  "time_budget_minutes": 15,
  "source_policy": "project_and_knowledge",
  "evidence_refs": ["evidence:EVD-playtest-001"]
}
