{
  "schema_version": 1,
  "request_id": "ARQ-f2s-adapter-demo",
  "created_at": "2026-08-27T18:10:00+08:00",
  "command": "request_analysis_decision",
  "project_ref": "f2s:Demo/deepdive",
  "host_write_target_ref": "f2s:Demo/deepdive/CHANGELOG.md#analysis-decision",
  "intent": "decide",
  "goal": "复盘试玩证据并提交下一轮原型方向的制作人选择包。",
  "decision_question": "下一轮应优先调整反馈时机还是补充线索可读性？",
  "requester_role": "producer",
  "time_budget_minutes": 30,
  "source_policy": "project_and_knowledge",
  "evidence_refs": ["project:Demo/deepdive/README.md", "evidence:EVD-playtest-001"]
}
